{
  "schema_version": "product-state-0.1",
  "product_or_workstream": "EXAMPLE_LABEL_API",
  "state_version": "3",
  "status": "CURRENT",
  "updated_at": "2030-03-01T12:00:00Z",
  "current_code_ref": "candidate/ref-t3",
  "product_objective": "Create and read labels through a JSON API.",
  "requirement_refs": ["REQ-LABEL-001", "REQ-LABEL-002"],
  "open_product_questions": [],
  "currentness_set": [
    "CLIENT_REQUIREMENTS_CURRENT.md",
    "PRODUCT_STATE_CURRENT.json",
    "IDENTITY_REGISTRY_CURRENT.json",
    "EXECUTION_AUTHORITY_CURRENT.json",
    "CAMPAIGN_LABEL_001_CHARTER.json",
    "TERMINAL_LABEL_001.json",
    "CURRENT_BOOTSTRAP_STATE.json"
  ],
  "capabilities": [
    {
      "id": "CAPABILITY_LABEL_API",
      "owner": "LABEL_SERVICE",
      "physical_state": "READY_FOR_PLANNER_ACCEPTANCE",
      "gate": "PLANNER_ACCEPTANCE",
      "dependencies": [],
      "evidence_refs": [
        "evidence/unit-complete",
        "evidence/integration-complete",
        "evidence/runtime-complete",
        "evidence/independent-review"
      ]
    }
  ],
  "active_campaign": {
    "campaign_id": "CAMPAIGN_LABEL_001",
    "charter_ref": "CAMPAIGN_LABEL_001_CHARTER.json",
    "checkpoint_or_terminal_ref": "TERMINAL_LABEL_001"
  },
  "current_gate": "PLANNER_ACCEPTANCE",
  "strongest_evidence_refs": [
    "evidence/runtime-complete",
    "evidence/independent-review"
  ],
  "blockers": [],
  "next_legal_boundary": "Planner reviews the exact terminal candidate and either accepts it or returns consolidated in-scope falsifiers.",
  "forbidden_actions": [
    "Mutate the reviewed candidate under the old favorable review.",
    "Publish externally."
  ]
}
